titleSpanish,titleEnglish,genre,CEFR,spanish,english
Feminismo,Feminism,politics,B2,"El feminismo, más que una sola ideología, es un conjunto de movimientos que buscan la igualdad real entre mujeres y hombres en la ley, en la economía y en la vida cotidiana. En España, los avances son visibles: más mujeres en la universidad, en la investigación y en la administración pública. Aun así, persisten problemas que no se resuelven solo con buenas intenciones. La brecha salarial, la infravaloración de los trabajos de cuidados y la violencia de género muestran que la igualdad jurídica no garantiza automáticamente la igualdad material. Dentro del propio feminismo hay matices y desacuerdos. Algunas corrientes apoyan las cuotas para acelerar la representación, mientras otras temen que estas oculten cambios más profundos. Hay debates sobre el lenguaje inclusivo, sobre cómo conciliar la vida laboral y familiar y sobre políticas concretas que afectan a los cuerpos y a la autonomía de las personas. Estas diferencias no invalidan el movimiento; obligan a clarificar objetivos, revisar datos y ajustar estrategias. Para que la igualdad avance, no bastan campañas puntuales. Haría falta una educación que cuestione estereotipos desde la infancia, horarios laborales más racionales y una corresponsabilidad real en los cuidados. Los medios y las redes deberían evitar caricaturas y centrarse en evidencias. Los hombres pueden ser aliados sin ocupar el centro. En resumen, el feminismo propone una sociedad más justa en la que el talento y la libertad no dependan del género.","Feminism, more than a single ideology, is a set of movements that seek real equality between women and men in the law, the economy, and everyday life. In Spain, progress is visible: more women in universities, in research, and in public administration. Even so, problems persist that cannot be solved with good intentions alone. The gender pay gap, the undervaluation of care work, and gender-based violence show that legal equality does not automatically guarantee material equality. Within feminism itself, there are nuances and disagreements. Some currents support quotas to accelerate representation, while others fear that these hide deeper changes. There are debates about inclusive language, how to balance work and family life, and specific policies that affect people's bodies and autonomy. These differences do not invalidate the movement; they require clarifying objectives, reviewing data, and adjusting strategies. For equality to advance, one-off campaigns are not enough. We need an education that challenges stereotypes from childhood, more rational working hours, and genuine shared responsibility for caregiving. The media and social networks should avoid caricatures and focus on evidence. Men can be allies without occupying the center stage. In short, feminism proposes a more just society in which talent and freedom are not dependent on gender."
Alimentos fermentados,Fermented Foods,food,C,"La fermentación, más que una técnica de conservación heredada, constituye una ecología controlada en la que levaduras, bacterias ácido-lácticas y, en menor medida, mohos transforman azúcares y otros sustratos en compuestos que alteran la textura, el perfil aromático y la biodisponibilidad de nutrientes. El yogur y el kéfir, los panes de masa madre, los encurtidos en salmuera, las aceitunas desamargadas, los quesos curados o el chucrut ilustran, cada uno en su matriz, cómo la acidificación y la producción de dióxido de carbono, alcoholes y ácidos orgánicos modulan tanto la seguridad microbiológica como la complejidad sensorial. No es casual que el paladar europeo asocie estas transformaciones con la idea de nobleza gastronómica: la fermentación, al degradar antinutrientes y predigerir parte de las proteínas y de los almidones, puede incrementar la digestibilidad y liberar notas umami y lácticas que difícilmente se obtienen por otras vías. Conviene, aun así, distinguir entre alimentos fermentados y productos con efecto probiótico. Que un alimento haya sido fermentado no garantiza que contenga microorganismos viables en el momento del consumo ni que las cepas presentes, de sobrevivir al tránsito gastrointestinal, ejerzan un beneficio clínicamente relevante. La evidencia es prometedora en parámetros concretos de salud digestiva y metabólica, pero es heterogénea y dependiente de cepas, dosis y hábitos dietéticos globales. De ahí que la recomendación prudente sea integrarlos como parte de una dieta variada, sin atribuirles virtudes cuasimedicinales. Tampoco deben ignorarse los riesgos. La elaboración casera exige higiene rigurosa, concentraciones de sal y temperaturas de fermentación adecuadas, y recipientes que minimicen la oxidación. Determinados quesos y encurtidos pueden concentrar aminas biógenas, lo que no sienta bien a quienes son sensibles a la histamina. En bebidas como la kombucha, el control del pH y del tiempo resulta crucial para evitar desviaciones microbianas o acéticos excesivos. Bien ejecutada, la fermentación combina placer, preservación y sostenibilidad; mal gestionada, no pasa de ser un experimento azaroso con consecuencias indeseables.","Fermentation, more than an inherited preservation technique, constitutes a controlled ecology in which yeasts, lactic acid bacteria, and, to a lesser extent, molds transform sugars and other substrates into compounds that alter texture, aromatic profile, and the bioavailability of nutrients. Yogurt and kefir, sourdough breads, brined pickles, debittered olives, aged cheeses, and sauerkraut each illustrate, in their own matrix, how acidification and the production of carbon dioxide, alcohols, and organic acids modulate both microbiological safety and sensory complexity. It’s no accident that the European palate associates these transformations with the idea of gastronomic nobility: by breaking down antinutrients and pre-digesting some proteins and starches, fermentation can increase digestibility and release umami and lactic notes that are hard to obtain by other means. Even so, it’s advisable to distinguish between fermented foods and products with a probiotic effect. The fact that a food has been fermented does not guarantee that it contains viable microorganisms at the moment of consumption, nor that the strains present—should they survive gastrointestinal transit—will exert a clinically relevant benefit. The evidence is promising for specific measures of digestive and metabolic health, but it is heterogeneous and dependent on strains, doses, and overall dietary habits. Hence the prudent recommendation is to include them as part of a varied diet, without attributing quasi-medicinal virtues to them. Nor should the risks be ignored. Home preparation requires rigorous hygiene, appropriate salt concentrations and fermentation temperatures, and vessels that minimize oxidation. Certain cheeses and pickles can concentrate biogenic amines, which do not sit well with those who are sensitive to histamine. In beverages such as kombucha, controlling pH and time is crucial to avoid microbial deviations or excessive acetic acid. Done well, fermentation combines pleasure, preservation, and sustainability; poorly managed, it amounts to a haphazard experiment with undesirable consequences."
Botiquines de primeros auxilios,First Aid Kits,health,A1,"Un botiquín de primeros auxilios es una caja con cosas importantes para ayudar en una emergencia. En el botiquín hay tiritas, gasas, tijeras, alcohol y guantes. También puede haber agua oxigenada y una manta pequeña. El botiquín es útil en casa, en el coche o en el trabajo. Es importante tenerlo en un lugar fácil de encontrar. Cuando una persona tiene una herida pequeña, podemos limpiar la herida y poner una tirita. El botiquín no es para enfermedades graves. En ese caso, es necesario llamar al médico o al número de emergencias.","A first aid kit is a box containing important items to help in an emergency. The kit contains bandages, gauze, scissors, alcohol, and gloves. It may also contain hydrogen peroxide and a small blanket. The kit is useful at home, in the car, or at work. It is important to keep it in an easy-to-find place. When someone has a small wound, we can clean the wound and put on a bandage. The kit is not for serious illnesses. In that case, it is necessary to call the doctor or the emergency number."
Maridaje de sabores,Flavor Pairing,food,B1,"Cuando cocinamos, no solo pensamos en los ingredientes por separado, sino también en cómo se combinan los sabores. La combinación de sabores es un arte que nos permite disfrutar de platos más interesantes y equilibrados. Por ejemplo, el dulce y el salado juntos pueden sorprendernos. Una mezcla muy común es el jamón con melón: la fruta aporta frescura y dulzura, mientras que el jamón añade un toque salado y sabroso. También existe la unión del ácido y el graso. Unas gotas de limón sobre un pescado frito hacen que el plato sea más ligero y agradable. Lo mismo ocurre cuando añadimos vinagre a una ensalada con aceite de oliva: el contraste hace que los sabores se intensifiquen. Además, el picante se puede combinar con el dulce. El chocolate con un poco de guindilla es una mezcla que cada vez gusta más, porque sorprende y estimula el paladar. En realidad, la clave está en probar y descubrir qué combinaciones nos gustan más. Cocinar no es solo seguir una receta, sino también experimentar y crear nuevas experiencias de sabor.","When we cook, we don't just think about the ingredients separately, but also about how the flavors combine. Combining flavors is an art that allows us to enjoy more interesting and balanced dishes. For example, sweet and salty together can surprise us. A very common combination is ham and melon: the fruit provides freshness and sweetness, while the ham adds a salty and savory touch. There is also the combination of acid and fat. A few drops of lemon juice on fried fish make the dish lighter and more enjoyable. The same thing happens when we add vinegar to a salad with olive oil: the contrast intensifies the flavors. Spicy and sweet can also be combined. Chocolate with a little chili pepper is a combination that is becoming increasingly popular because it surprises and stimulates the palate. In reality, the key is to try and discover which combinations we like best. Cooking is not just about following a recipe, but also about experimenting and creating new flavor experiences."
Coches voladores,Flying Cars,science fiction,A1,"En el futuro hay coches voladores. Estos coches son muy rápidos y muy grandes. Las personas pueden viajar en el aire y no en la calle. Un coche volador tiene alas y también tiene un motor especial. Con un coche volador, una familia puede ir a la escuela o al trabajo sin tráfico. También es posible viajar a otra ciudad en poco tiempo. Muchas personas quieren un coche volador porque es moderno y divertido. ¿Te gusta la idea de un coche que vuela?","In the future, there will be flying cars. These cars are very fast and very large. People can travel in the air instead of on the road. A flying car has wings and a special engine. With a flying car, a family can go to school or work without traffic. It is also possible to travel to another city in a short time. Many people want a flying car because it is modern and fun. Do you like the idea of a flying car?"
El español formal,Formal Spanish,language,A2,"En español usamos dos formas para hablar con otras personas: una formal y otra informal. Con amigos, familia o personas jóvenes usamos tú. Con personas mayores, con desconocidos o en situaciones de trabajo usamos usted. Por ejemplo, decimos: ¿Cómo estás? a un amigo, pero ¿Cómo está usted? a un profesor o a un jefe. La diferencia es importante porque muestra respeto y educación. También cambiamos los verbos. Con tú decimos: ¿Quieres un café? y con usted decimos: ¿Quiere usted un café? En muchos países hispanohablantes, hablar de manera formal es una señal de cortesía. En España, poco a poco, se usa más tú, pero en situaciones oficiales o con personas desconocidas todavía se prefiere usted.","In Spanish, we use two forms to speak to other people: one formal and one informal. With friends, family, or young people, we use tú. With older people, strangers, or in work situations, we use usted. For example, we say: ¿Cómo estás? to a friend, but ¿Cómo está usted? to a teacher or boss. The difference is important because it shows respect and politeness. We also change the verbs. With tú we say: ¿Quieres un café? (Would you like a coffee?) and with usted we say: ¿Quiere usted un café? (Would you like a coffee?) In many Spanish-speaking countries, speaking formally is a sign of courtesy. In Spain, little by little, tú is being used more, but in official situations or with strangers, usted is still preferred."
La España franquista,Francoist Spain,history,B2,"Después de la Guerra Civil española, que terminó en 1939, el general Francisco Franco estableció una dictadura que duró casi cuarenta años. Durante este periodo, conocido como el franquismo, el régimen se caracterizó por la censura, la represión política y la falta de libertades democráticas. Los partidos políticos y los sindicatos fueron prohibidos, y muchas personas que se oponían al régimen fueron encarceladas o tuvieron que exiliarse. La ideología franquista estaba influida por el nacionalismo y el catolicismo. Se promovía una visión muy centralista de España, lo que afectó a las lenguas y culturas regionales, como el catalán, el vasco o el gallego, que no podían usarse en la vida pública. Al mismo tiempo, la Iglesia católica tenía un papel fundamental en la educación y en la vida social. En la década de 1950, España se fue abriendo poco a poco a la comunidad internacional y, con el tiempo, llegaron acuerdos económicos con otros países que ayudaron al crecimiento económico de los años sesenta. Sin embargo, la falta de libertad política continuó hasta la muerte de Franco en 1975. Tras su fallecimiento, España inició un proceso de transición hacia la democracia, que culminó con la Constitución de 1978. Este periodo marcó el final de la dictadura y el inicio de una nueva etapa en la historia del país.","After the Spanish Civil War, which ended in 1939, General Francisco Franco established a dictatorship that lasted almost forty years. During this period, known as Francoism, the regime was characterized by censorship, political repression, and a lack of democratic freedoms. Political parties and trade unions were banned, and many people who opposed the regime were imprisoned or forced into exile. Franco's ideology was influenced by nationalism and Catholicism. A very centralist view of Spain was promoted, which affected regional languages and cultures, such as Catalan, Basque, and Galician, which could not be used in public life. At the same time, the Catholic Church played a fundamental role in education and social life. In the 1950s, Spain gradually opened up to the international community and, over time, economic agreements were reached with other countries that helped economic growth in the 1960s. However, the lack of political freedom continued until Franco's death in 1975. After his death, Spain began a process of transition to democracy, which culminated in the Constitution of 1978. This period marked the end of the dictatorship and the beginning of a new stage in the country's history."
Frankenstein,Frankenstein,horror,B1,"Un joven llamado Víctor Frankenstein creció en una familia rica y feliz en Ginebra. Desde pequeño mostró un gran interés por la ciencia y los secretos de la vida. Cuando fue a estudiar a la universidad, se obsesionó con la idea de crear un ser vivo a partir de partes de cuerpos muertos. Después de muchos meses de trabajo, consiguió dar vida a una criatura. Al verla moverse y respirar, Víctor sintió miedo y horror. La criatura tenía una apariencia espantosa, con una piel amarillenta y ojos apagados. Aunque era fuerte e inteligente, nadie podía soportar su aspecto. Víctor la abandonó, incapaz de aceptar lo que había hecho. El ser, solo y rechazado por todos, aprendió a hablar y leer observando a una familia campesina. Quería ser aceptado, pero siempre recibía violencia y desprecio. Lleno de tristeza y rabia, buscó a su creador y le pidió una compañera para no vivir en soledad. Víctor, primero conmovido, empezó a trabajar en la creación de una segunda criatura. Sin embargo, cambió de idea y destruyó su obra antes de terminarla. El monstruo juró entonces vengarse. Poco a poco, fue quitándole a Víctor todo lo que amaba: mató a su hermano, a su mejor amigo y finalmente a su esposa en la noche de bodas. Consumido por el dolor, Víctor dedicó su vida a perseguir a la criatura por toda Europa, hasta llegar a regiones heladas del norte. Allí, agotado y enfermo, contó su historia a un explorador que viajaba por el Ártico. Poco después murió. La criatura, al descubrir la muerte de su creador, lloró con remordimiento. Reconoció que su vida había sido una cadena de odio y sufrimiento. Decidió alejarse en la oscuridad del hielo, con la intención de desaparecer para siempre.","A young man named Victor Frankenstein grew up in a wealthy and happy family in Geneva. From an early age, he showed a keen interest in science and the secrets of life. When he went to university, he became obsessed with the idea of creating a living being from the parts of dead bodies. After many months of work, he succeeded in bringing a creature to life. Seeing it move and breathe, Victor felt fear and horror. The creature had a terrifying appearance, with yellowish skin and dull eyes. Although it was strong and intelligent, no one could bear its appearance. Victor abandoned it, unable to accept what he had done. The creature, alone and rejected by everyone, learned to speak and read by observing a peasant family. It wanted to be accepted, but it was always met with violence and contempt. Filled with sadness and rage, it sought out its creator and asked him for a companion so that it would not have to live in solitude. Victor, initially moved, began working on the creation of a second creature. However, he changed his mind and destroyed his work before finishing it. The monster then swore revenge. Little by little, it took away everything Victor loved: it killed his brother, his best friend, and finally his wife on their wedding night. Consumed by grief, Victor devoted his life to pursuing the creature throughout Europe, until he reached the frozen regions of the north. There, exhausted and ill, he told his story to an explorer traveling through the Arctic. Shortly thereafter, he died. Upon discovering the death of its creator, the creature wept with remorse. It recognized that its life had been a chain of hatred and suffering. It decided to retreat into the darkness of the ice, with the intention of disappearing forever."
El libre albedrío,Free Will,philosophy,C,,
Friedrich Nietzsche,Friedrich Nietzsche,biography,B2,"Friedrich Nietzsche fue un filósofo alemán del siglo XIX conocido por sus ideas provocadoras y, a menudo, controvertidas. Su pensamiento cuestionaba los valores tradicionales de la sociedad europea, especialmente la religión y la moral cristiana. Nietzsche defendía la necesidad de que el ser humano crease sus propios valores y no aceptara de manera pasiva las normas impuestas por la cultura o la religión. Una de sus ideas más famosas es la del “superhombre” (Übermensch), una figura que representa a quien supera las limitaciones sociales y morales para vivir de forma auténtica y creativa. También es muy conocida su afirmación de que “Dios ha muerto”, que no debe entenderse de manera literal, sino como una crítica a la pérdida de fe y a la crisis de valores en la modernidad. Aunque en vida no tuvo gran reconocimiento, con el tiempo su obra influyó en muchos pensadores, escritores y artistas. Hoy en día, Nietzsche sigue siendo un autor debatido: algunos lo consideran un visionario, mientras que otros lo critican por la ambigüedad de sus ideas. Lo cierto es que su filosofía invita a reflexionar sobre la libertad, la responsabilidad y la necesidad de buscar un sentido propio a la vida.","Friedrich Nietzsche was a 19th-century German philosopher known for his provocative and often controversial ideas. His thinking challenged the traditional values of European society, especially religion and Christian morality. Nietzsche argued that human beings should create their own values and not passively accept the norms imposed by culture or religion. One of his most famous ideas is that of the “superman” (Übermensch), a figure who overcomes social and moral limitations to live authentically and creatively. His statement that “God is dead” is also well known, which should not be understood literally, but as a criticism of the loss of faith and the crisis of values in modernity. Although he did not receive much recognition during his lifetime, over time his work influenced many thinkers, writers, and artists. Today, Nietzsche remains a controversial author: some consider him a visionary, while others criticize him for the ambiguity of his ideas. What is certain is that his philosophy invites reflection on freedom, responsibility, and the need to seek one's own meaning in life."
Hongos,Fungi,science,B1,"Los hongos son organismos muy interesantes que aparecen en muchos lugares del mundo. No son plantas ni animales, sino que forman un grupo diferente. Pueden vivir en el suelo, en los árboles o incluso dentro de otros seres vivos. Muchos hongos son útiles para las personas. Por ejemplo, algunos sirven de alimento, como las setas, y otros se usan para producir pan, cerveza o queso gracias a la fermentación. Sin embargo, no todos los hongos son buenos. Algunos son venenosos y peligrosos para la salud si se comen. Por eso es importante conocerlos bien antes de recogerlos en el bosque. Además, existen hongos microscópicos que pueden causar enfermedades, aunque también hay hongos que ayudan a las plantas a crecer mejor al compartir nutrientes con ellas. Los hongos forman parte de la naturaleza y tienen un papel importante en los ecosistemas. Ayudan a descomponer restos de hojas y madera, devolviendo nutrientes al suelo. Sin ellos, la vida en la Tierra sería muy diferente.","Fungi are very interesting organisms that appear in many places around the world. They are neither plants nor animals, but form a separate group. They can live in the soil, on trees, or even inside other living beings. Many fungi are useful to humans. For example, some are used as food, such as mushrooms, and others are used to produce bread, beer, or cheese through fermentation. However, not all fungi are good. Some are poisonous and dangerous to health if eaten. That is why it is important to know them well before picking them in the forest. In addition, there are microscopic fungi that can cause disease, although there are also fungi that help plants grow better by sharing nutrients with them. Fungi are part of nature and play an important role in ecosystems. They help break down leaf and wood debris, returning nutrients to the soil. Without them, life on Earth would be very different."
Diseño de videojuegos,Game Design,technology,B1,"El diseño de videojuegos es un proceso creativo que combina arte, tecnología e imaginación. Un diseñador de juegos no solo piensa en los gráficos o en los sonidos, sino también en cómo se juega. Es decir, debe decidir cuáles son las reglas, qué objetivos tiene el jugador y cómo se puede ganar o perder. Normalmente, el trabajo empieza con una idea sencilla, como un personaje que debe superar obstáculos o un mundo que hay que explorar. Después, el equipo desarrolla la historia, los niveles y la jugabilidad. La jugabilidad es muy importante, porque si un juego no resulta divertido o demasiado difícil, los jugadores se cansan rápido. El diseño también incluye pensar en la experiencia del usuario. Por ejemplo, ¿es fácil entender qué hacer?, ¿hay suficientes pistas para avanzar?, ¿los controles son cómodos? Todo esto influye mucho en si un videojuego tiene éxito o no. Hoy en día, el diseño de videojuegos está creciendo mucho porque cada vez más personas juegan, no solo jóvenes, sino también adultos. Por eso, los diseñadores buscan crear juegos que sean accesibles y entretenidos para todo tipo de público.","Video game design is a creative process that combines art, technology, and imagination. A game designer doesn't just think about graphics or sounds, but also about how the game is played. In other words, they must decide what the rules are, what the player's objectives are, and how the game can be won or lost. The work usually starts with a simple idea, such as a character who must overcome obstacles or a world that must be explored. Then, the team develops the story, the levels, and the gameplay. Gameplay is very important because if a game is not fun or too difficult, players get tired of it quickly. Design also includes thinking about the user experience. For example, is it easy to understand what to do? Are there enough clues to move forward? Are the controls comfortable? All of this greatly influences whether a video game is successful or not. Today, video game design is growing rapidly because more and more people are playing, not just young people, but adults as well. That's why designers seek to create games that are accessible and entertaining for all types of audiences."
