titleSpanish,titleEnglish,genre,CEFR,spanish,english
La vida de los otros,The Lives of Others,drama,B2,"En 1984, en la República Democrática Alemana, el capitán Gerd Wiesler trabaja para la Stasi como experto en vigilancia. Le encargan vigilar a Georg Dreyman, un dramaturgo famoso y aparentemente leal al régimen, y a su pareja, la actriz Christa-Maria Sieland. La operación no es solo política. El ministro Hempf desea a Christa-Maria y, con esa excusa, fuerza la investigación. Wiesler instala micrófonos en el piso y empieza a escuchar sus vidas día y noche. Al principio, Wiesler es un funcionario frío y meticuloso. Poco a poco, al oír conversaciones íntimas, silencios y música, empieza a cambiar. Dreyman se entera del suicidio de un director de teatro vetado y decide escribir en secreto un artículo para una revista occidental sobre el tabú de los suicidios en la RDA. Un amigo le consigue una pequeña máquina de escribir, que esconde bajo el umbral del suelo. Wiesler descubre el plan, pero en lugar de detenerlo, lo protege. Manipula informes, suaviza transcripciones y, antes de un registro, llega a retirar la máquina de su escondite para que los agentes no la encuentren. Christa-Maria, mientras tanto, vive atrapada entre su talento, su dependencia y el acoso del ministro. La Stasi la presiona y la amenaza con destruir su carrera. Bajo ese chantaje, termina delatando a Dreyman y revela el escondite de la máquina. Cuando comprende lo que ha hecho, intenta rectificar, huye a la calle y muere atropellada. Dreyman queda roto, sin saber que alguien dentro de la propia Stasi lo ha estado cuidando. A Wiesler lo degradan por no haber producido resultados claros. Pasa de investigador estrella a abrir cartas en un sótano, luego a repartir correo. Su vida se reduce a una rutina gris, pero mantiene el secreto. Tras la caída del Muro, Dreyman solicita sus expedientes y descubre la verdad. Lee páginas y páginas firmadas con el código HGW XX/7, donde se ve cómo aquel agente lo salvó. Entiende que no estuvo solo. Años después publica un libro titulado Sonata para un hombre bueno, dedicado a HGW XX/7. Wiesler, ahora cartero, entra en una librería, lo abre y lee la dedicatoria. Cuando la dependienta le pregunta si quiere envolverlo, contesta simplemente que no, que es para él.","In 1984, in the German Democratic Republic, Captain Gerd Wiesler works for the Stasi as a surveillance expert. He is assigned to monitor Georg Dreyman, a famous playwright apparently loyal to the regime, and his partner, actress Christa-Maria Sieland. The operation is not merely political. Minister Hempf desires Christa-Maria and, using this as an excuse, forces the investigation. Wiesler installs microphones in the apartment and begins listening in on their lives day and night. At first, Wiesler is a cold and meticulous civil servant. Little by little, as he overhears intimate conversations, silences, and music, he begins to change. Dreyman learns of the suicide of a banned theater director and decides to secretly write an article for a Western magazine about the taboo against suicide in the GDR. A friend gets him a small typewriter, which he hides under the threshold. Wiesler discovers the plan, but instead of stopping it, he protects it. He manipulates reports, softens transcripts, and, before a search, even removes the machine from its hiding place so the agents wouldn't find it. Christa-Maria, meanwhile, lives trapped between her talent, her dependency, and the minister's harassment. The Stasi pressures her and threatens to destroy her career. Under this blackmail, she ends up betraying Dreyman and revealing the machine's hiding place. When she realizes what she's done, she tries to rectify it, flees into the street, and is run over. Dreyman is devastated, unaware that someone within the Stasi itself has been watching over him. Wiesler is demoted for failing to produce clear results. He goes from star investigator to opening letters in a basement, then to delivering mail. His life is reduced to a drab routine, but he maintains the secret. After the fall of the Wall, Dreyman requests his files and discovers the truth. He reads pages and pages signed with the code HGW XX/7, where we see how that agent saved him. He understands that he was not alone. Years later, he published a book titled Sonata for a Good Man, dedicated to HGW XX/7. Wiesler, now a postman, entered a bookstore, opened it, and read the dedication. When the clerk asked him if he would like it wrapped, he simply replied no, that it was for him."
La cartera perdida,The Lost Wallet,dialogue,A2,,
Dieta mediterránea,The Mediterranean Diet,health,A2,"La dieta mediterránea es un estilo de vida, no solo una lista de comidas. Se basa en frutas y verduras frescas, legumbres, cereales integrales, aceite de oliva y pescado, sobre todo pescado azul. La carne roja se come pocas veces al mes y en porciones pequeñas. Los postres suelen ser fruta. Se bebe agua durante el día y, en adultos, a veces vino con moderación en las comidas. También es importante cocinar en casa y compartir la mesa con la familia o los amigos. Un día típico puede ser así: para desayunar, pan integral con tomate y aceite de oliva, y café con leche o té. A media mañana, un yogur natural o una pieza de fruta. Para comer, una ensalada grande, lentejas o arroz con verduras, y pescado a la plancha. De merienda, un puñado de frutos secos. Para cenar, crema de verduras y una tortilla francesa con ensalada. Este modelo ayuda al corazón y al peso, porque los alimentos son naturales y tienen fibra. Además, caminar cada día y dormir bien forma parte de la misma idea de salud.","The Mediterranean diet is a lifestyle, not just a list of foods. It is based on fresh fruits and vegetables, legumes, whole grains, olive oil, and fish, especially oily fish. Red meat is eaten only a few times a month and in small portions. Desserts are usually fruit. Water is drunk throughout the day and, for adults, sometimes wine in moderation with meals. It is also important to cook at home and share meals with family or friends. A typical day might look like this: for breakfast, whole grain bread with tomato and olive oil, and coffee with milk or tea. Mid-morning, a plain yogurt or a piece of fruit. For lunch, a large salad, lentils or rice with vegetables, and grilled fish. For an afternoon snack, a handful of nuts. For dinner, cream of vegetable soup and a French omelet with salad. This model is good for the heart and weight, because the foods are natural and contain fiber. In addition, walking every day and sleeping well are part of the same idea of health."
La metamorfosis,The Metamorphosis,drama,C,,
El cine,The Movie Theater,dialogue,A1,"Lucía y Marta caminan por la calle. El sol ya está bajo y las luces del cine brillan. “¿Quieres ir al cine esta noche?” pregunta Lucía con una sonrisa. “Sí, quiero mucho. ¿Qué película vemos?” responde Marta. Lucía mira el cartel. “Hay una comedia y una película de acción.” “Prefiero la comedia,” dice Marta. “Me gusta reír.” “Perfecto,” responde Lucía. “¿A qué hora empieza?” “A las ocho,” contesta Marta. “Tenemos tiempo.” Las dos entran en el cine, contentas, y compran sus entradas.","Lucía and Marta are walking down the street. The sun is already low and the movie theater lights are shining brightly. “Do you want to go to the movies tonight?” Lucía asks with a smile. “Yes, I'd love to. What movie should we see?” Marta replies. Lucía looks at the poster. “There's a comedy and an action movie.” “I prefer the comedy,” says Marta. “I like to laugh.” “Perfect,” replies Lucía. “What time does it start?” “At eight,” answers Marta. “We have time.” The two enter the cinema, happy, and buy their tickets."
El Estado-nación,The Nation-State,politics,B2,,
Los dioses nórdicos,The Norse Gods,fantasy,B2,"En la mitología nórdica, los dioses habitan Asgard y vigilan a los humanos que viven en Midgard, dos de los mundos que cuelgan del fresno cósmico Yggdrasil. Odín, el padre de todos, sacrifica un ojo para alcanzar la sabiduría y cuelga del árbol durante nueve noches para aprender las runas. No representa la bondad perfecta, sino la búsqueda de conocimiento a cualquier precio, algo que define a muchos dioses nórdicos. Thor, dios del trueno, protege a los mortales con su martillo Mjölnir, que siempre regresa a su mano. Es impulsivo, pero también justo, y combate a los gigantes que amenazan el orden. Frigg, esposa de Odín, es asociada con la familia y el destino. Freyja, vinculada al amor, la guerra y la magia seiðr, demuestra que lo bello y lo terrible pueden convivir. Loki, figura ambigua y cambiante, provoca desastres con sus engaños, aunque a veces ayuda a resolverlos. Su carácter imprevisible hace que los relatos mantengan una tensión constante. Otros dioses importantes son Tyr, que pierde la mano al encadenar al lobo Fenrir, y Baldr, cuya muerte anuncia una gran transformación. Muchos héroes esperan en el Valhalla, donde se entrenan para el combate final. Todo culmina en el Ragnarök, una batalla que destruye gran parte del universo. Sin embargo, la tradición cuenta que el mundo renace después y que algunos dioses y humanos sobreviven. Esta visión del fin y del comienzo, marcada por el destino y el valor ante la pérdida, explica por qué estas leyendas siguen resultando tan poderosas hoy.","In Norse mythology, the gods inhabit Asgard and watch over the humans who live in Midgard, two of the worlds that hang from the cosmic ash tree Yggdrasil. Odin, the all-father, sacrifices an eye to achieve wisdom and hangs from the tree for nine nights to learn the runes. He does not represent perfect goodness, but rather the pursuit of knowledge at any cost, something that defines many Norse gods. Thor, god of thunder, protects mortals with his hammer Mjölnir, which always returns to his hand. He is impulsive, but also just, and fights the giants who threaten order. Frigg, Odin's wife, is associated with family and destiny. Freyja, linked to love, war, and seiðr magic, demonstrates that beauty and terror can coexist. Loki, an ambiguous and changeable figure, causes disasters with his tricks, although he sometimes helps resolve them. His unpredictable nature keeps the stories constantly tense. Other important gods are Tyr, who loses his hand while chaining the wolf Fenrir, and Baldr, whose death heralds a great transformation. Many heroes await in Valhalla, where they train for the final battle. It all culminates in Ragnarök, a battle that destroys much of the universe. However, tradition tells us that the world is reborn afterward, and that some gods and humans survive. This vision of the end and the beginning, marked by destiny and courage in the face of loss, explains why these legends remain so powerful today."
La ciudad vieja de Jerusalén,The Old City of Jerusalem,travel,A2,"La Ciudad Vieja de Jerusalén es un lugar muy especial y famoso en el mundo. Está en Israel y tiene una historia muy larga. Muchas personas la visitan cada año porque es importante para varias religiones, como el cristianismo, el judaísmo y el islam. La ciudad tiene murallas antiguas y varias puertas para entrar. Dentro hay calles pequeñas y llenas de vida. Se pueden ver mercados con comida, ropa y recuerdos para turistas. También hay lugares santos, como el Muro de las Lamentaciones, la Iglesia del Santo Sepulcro y la Cúpula de la Roca. Pasear por la Ciudad Vieja es como viajar al pasado. Las casas y las piedras cuentan historias de muchos siglos. Es un sitio donde diferentes culturas y tradiciones viven juntas, y por eso es tan especial para el mundo.","The Old City of Jerusalem is a very special and famous place in the world. It is in Israel and has a very long history. Many people visit it every year because it is important to several religions, such as Christianity, Judaism, and Islam. The city has ancient walls and several gates to enter. Inside, there are small streets full of life. You can see markets with food, clothing, and souvenirs for tourists. There are also holy sites, such as the Western Wall, the Church of the Holy Sepulchre, and the Dome of the Rock. Walking through the Old City is like traveling back in time. The houses and stones tell stories from many centuries ago. It is a place where different cultures and traditions live together, which is why it is so special to the world."
La paradoja de la elección,The Paradox of Choice,psychology,C,,
La farmacia,The Pharmacy,dialogue,A1,"Marta entra en la farmacia y sonríe al farmacéutico. “Buenos días”, dice ella. “Buenos días”, responde el farmacéutico. “¿Qué necesita?” “Quiero unas pastillas para el dolor de cabeza”, explica Marta. “Sí, claro”, dice el farmacéutico. “¿Algo más?” “También necesito un jarabe para la tos”, añade Marta. “Perfecto. Aquí tiene las pastillas y el jarabe”, responde él mientras coloca las cajas en el mostrador. “Gracias. ¿Cuánto es?”, pregunta Marta. “Son ocho euros”, responde el farmacéutico. Marta paga con una sonrisa. “Muchas gracias. Adiós.” “Adiós. Que se mejore”, dice el farmacéutico.","Marta enters the pharmacy and smiles at the pharmacist. “Good morning,” she says. “Good morning,” replies the pharmacist. “What do you need?” “I want some pills for a headache,” explains Marta. “Yes, of course,” says the pharmacist. “Anything else?” “I also need some cough syrup,” adds Marta. “Perfect. Here are the pills and the syrup,” he replies as he places the boxes on the counter. “Thank you. How much is it?” asks Marta. “It's eight euros,” replies the pharmacist. Marta pays with a smile. “Thank you very much. Goodbye.” “Goodbye. Get well soon,” says the pharmacist."
La filosofía de las segundas lenguas,The Philosophy of Second Languages,philosophy,C,,
El efecto placebo,The Placebo Effect,psychology,B2,"El efecto placebo es la mejoría real de un paciente después de recibir una sustancia o un procedimiento sin principio activo. No se trata de que la persona “se lo imagine”, sino de que la expectativa de alivio activa procesos biológicos medibles. Por eso, en los ensayos clínicos se usan placebos para comparar resultados y comprobar si un fármaco funciona más allá de la sugestión. En un estudio doble ciego, ni los participantes ni los investigadores saben quién recibe el medicamento y quién recibe el placebo, lo que reduce sesgos y aumenta la fiabilidad de las conclusiones. Los mecanismos del efecto placebo son diversos. La expectativa positiva puede reducir la percepción del dolor mediante la liberación de endorfinas y la activación de circuitos dopaminérgicos. También influye el condicionamiento: si un tratamiento se asocia repetidamente con mejoría, el cuerpo aprende a responder. Además, el contexto importa. El tono de voz del profesional, la bata blanca, el tamaño y el color de la pastilla o la confianza en el sistema sanitario modulan la respuesta. Lo contrario se llama efecto nocebo, cuando la expectativa negativa empeora los síntomas. En la práctica clínica, el placebo puede aliviar dolor, insomnio o ansiedad, sobre todo cuando los síntomas son subjetivos y fluctuantes. Sin embargo, tiene límites. No cura infecciones ni sustituye tratamientos necesarios, y su uso sin transparencia plantea problemas éticos. Por eso crece el interés por los placebos “abiertos”, en los que el paciente sabe que toma un placebo y aun así mejora. En definitiva, comprender el efecto placebo ayuda a diseñar mejores ensayos y a cuidar mejor la relación entre profesionales y pacientes.","The placebo effect is the actual improvement of a patient after receiving a substance or procedure without an active ingredient. It's not a matter of the person ""imagining it,"" but rather the expectation of relief that activates measurable biological processes. Therefore, in clinical trials, placebos are used to compare results and verify whether a drug works beyond suggestion. In a double-blind study, neither the participants nor the researchers know who is receiving the drug and who is receiving the placebo, which reduces bias and increases the reliability of the conclusions. The mechanisms of the placebo effect are diverse. Positive expectation can reduce the perception of pain by releasing endorphins and activating dopaminergic circuits. Conditioning also plays a role: if a treatment is repeatedly associated with improvement, the body learns to respond. Furthermore, context matters. The tone of voice of the professional, the white coat, the size and color of the pill, or trust in the healthcare system modulate the response. The opposite is called the nocebo effect, when negative expectation worsens symptoms. In clinical practice, placebos can relieve pain, insomnia, or anxiety, especially when symptoms are subjective and fluctuating. However, they have limits. They do not cure infections or replace necessary treatments, and their use without transparency raises ethical issues. This is why there is growing interest in ""open"" placebos, in which the patient knows they are taking a placebo and still improves. Ultimately, understanding the placebo effect helps design better trials and better maintain the relationship between professionals and patients."
La oficina de correos,The Post Office,dialogue,A2,,
La psicología de la felicidad,The Psychology of Happiness,psychology,B1,"La psicología de la felicidad estudia qué nos ayuda a vivir con más bienestar. Muchos expertos dicen que la felicidad no es un momento de euforia, sino un estado que se construye cada día con pequeñas decisiones. No se trata de tener una vida perfecta, sino de aceptar la realidad y centrarse en lo que sí podemos cambiar. Un primer pilar son las relaciones. Cuando hablamos con amigos, ofrecemos ayuda y recibimos apoyo, el cerebro se calma y sentimos seguridad. Incluso una conversación corta puede mejorar el ánimo. Por eso conviene cuidar las amistades, dedicar tiempo a la familia y decir gracias más a menudo. El segundo pilar es el sentido. Tener una meta clara, aunque sea sencilla, da dirección. Puede ser aprender algo nuevo, mejorar la salud o colaborar en una causa local. Cuando nuestras acciones coinciden con nuestros valores, aparece una satisfacción profunda y estable. El tercer pilar son los hábitos. Dormir bien, moverse a diario y comer de forma equilibrada influyen en el humor. También ayudan ejercicios mentales como la gratitud o prestar atención al presente. En cambio, compararnos todo el tiempo con otras personas o pasar horas en redes suele reducir la alegría. La felicidad no elimina las emociones difíciles. Significa reconocerlas, pedir ayuda cuando es necesario y seguir adelante con pasos pequeños y constantes.","The psychology of happiness studies what helps us live with greater well-being. Many experts say that happiness isn't a moment of euphoria, but rather a state that is built every day with small decisions. It's not about having a perfect life, but rather accepting reality and focusing on what we can change. The first pillar is relationships. When we talk to friends, offer help, and receive support, our brains calm down and we feel secure. Even a short conversation can improve our mood. That's why it's important to nurture our friendships, spend time with our family, and say thank you more often. The second pillar is meaning. Having a clear goal, even a simple one, provides direction. It might be learning something new, improving our health, or contributing to a local cause. When our actions align with our values, a deep and lasting satisfaction emerges. The third pillar is habits. Sleeping well, exercising daily, and eating a balanced diet all influence our mood. Mental exercises such as gratitude or paying attention to the present also help. On the other hand, constantly comparing ourselves with other people or spending hours on social media often reduces joy. Happiness doesn't eliminate difficult emotions. It means recognizing them, asking for help when necessary, and moving forward with small, steady steps."
La psicología de la soledad,The Psychology of Loneliness,psychology,B2,,
El cuervo,The Raven,horror,B2,"Era medianoche en una habitación silenciosa. El narrador, cansado y abatido por la muerte de Lenore, trataba de distraerse leyendo libros antiguos. De pronto oyó un golpecito en la puerta. Pensó que sería una visita tardía y, con el corazón acelerado, abrió para encontrar solo oscuridad. Pronunció el nombre de Lenore y el eco se lo devolvió, vacío. Cuando volvió a sentarse, escuchó un golpecito más fuerte en la ventana. La abrió y entró un cuervo negro, solemne, que fue directo a posarse sobre un busto de Palas Atenea, encima de la puerta. Su presencia era inquietante y, sin saber por qué, el hombre le preguntó su nombre. El cuervo respondió con una sola palabra, clara y dura: Nunca más. Al principio el narrador sonrió. Supuso que el ave había aprendido esa frase de algún dueño desgraciado. Colocó un sillón frente al busto y se quedó observando al pájaro, pensando en la pérdida de Lenore y en el sentido de aquella respuesta. La habitación, el perfume de las cortinas y la luz moribunda de la lámpara creaban un ambiente extraño, como si el aire pesara. Buscando consuelo, formuló preguntas más hondas. Preguntó si hallaría alivio a su dolor, si existía algún bálsamo para la pena que lo consumía. El cuervo dijo Nunca más. Con miedo y esperanza mezclados, preguntó si volvería a abrazar a Lenore en el Edén. Otra vez, la misma sentencia: Nunca más. La palabra, repetida, se convirtió en un martillo. El narrador sintió que el destino le hablaba a través de un animal que no comprendía su dolor. Desesperado, le ordenó al cuervo que se marchara y que dejara en paz su casa y su corazón. La respuesta fue idéntica, inamovible, como una puerta cerrada. El cuervo no se movió. Siguió allí, sobre el busto de Palas, con ojos que parecían soñar. Su sombra cayó sobre el suelo y sobre el alma del hombre, que comprendió que no habría olvido ni descanso. Desde entonces, el cuervo sigue inmóvil y su sombra cubre la habitación, mientras el narrador siente que su propia alma yace presa debajo de esa sombra, para siempre.","It was midnight in a quiet room. The narrator, tired and dejected by Lenore's death, was trying to distract himself by reading old books. Suddenly, he heard a tap on the door. He thought it must be a late visitor and, his heart racing, opened it to find only darkness. He spoke Lenore's name and the echo returned, empty. When he sat back down, he heard a louder tap on the window. He opened it, and a solemn black raven flew in and landed directly on a bust of Pallas Athena above the door. Its presence was unsettling, and, without knowing why, the man asked its name. The raven replied with a single, clear, and harsh word: Nevermore. At first, the narrator smiled. He assumed the bird had learned that phrase from some unfortunate owner. He placed an armchair opposite the bust and watched the bird, thinking about the loss of Lenore and the meaning of that answer. The room, the scent of the curtains, and the fading light from the lamp created a strange atmosphere, as if the air held weight. Seeking solace, he asked deeper questions. He asked if he would find relief from his pain, if there was any balm for the grief that consumed him. The raven said, ""Nevermore."" With fear and hope mingled, he asked if he would embrace Lenore again in Eden. Again, the same sentence: ""Nevermore."" The word, repeated, became a hammer. The storyteller felt fate speaking to him through an animal that didn't understand his pain. Desperate, he ordered the raven to leave his house and his heart alone. The answer was identical, immovable, like a closed door. The raven didn't move. It remained there, on the bust of Pallas, with eyes that seemed to dream. Its shadow fell upon the ground and upon the man's soul, who understood that there would be no forgetting, no rest. Since then, the raven remains motionless and its shadow covers the room, while the narrator feels that his own soul lies imprisoned beneath that shadow, forever."
El Renacimiento,The Renaissance,history,B1,,
El restaurante,The Restaurant,dialogue,A2,,
El papel de la suerte en la historia,The Role of Luck in History,history,A2,"En la historia, muchas veces la suerte tiene un papel muy importante. A veces, una persona hace un gran descubrimiento por casualidad. Por ejemplo, un científico puede buscar una cosa y encontrar otra diferente que cambia el mundo. También, en las batallas, el clima o un error pequeño pueden decidir el resultado. La suerte no explica todo, porque también hay trabajo, esfuerzo y preparación. Sin embargo, muchas personas creen que estar en el lugar correcto en el momento correcto puede cambiar la vida. La historia está llena de ejemplos donde la suerte ayuda o perjudica a los seres humanos.","In history, luck often plays a very important role. Sometimes, a person makes a great discovery by chance. For example, a scientist may be looking for one thing and find something else that changes the world. Also, in battles, the weather or a small mistake can decide the outcome. Luck does not explain everything, because there is also work, effort, and preparation. However, many people believe that being in the right place at the right time can change your life. History is full of examples where luck helps or harms human beings."
El papel de los viajes en el autodescubrimiento,The Role of Travel in Self-Discovery,travel,B2,,
