titleSpanish,titleEnglish,genre,CEFR,spanish,english
Revolución industrial,The Industrial Revolution,history,B1,"La Revolución Industrial fue un periodo de grandes cambios que empezó en el siglo XVIII, primero en el Reino Unido y después en otros países de Europa. Antes, la mayoría de la gente vivía en el campo y trabajaba en la agricultura o en pequeños talleres artesanales. Con la llegada de nuevas máquinas, como la máquina de vapor, la producción empezó a hacerse en fábricas. Esto permitió fabricar textiles, hierro y otros productos de forma más rápida y barata. Muchas personas se mudaron a las ciudades para trabajar como obreros. Las jornadas eran largas y los salarios, bajos. Las condiciones laborales eran difíciles y no había normas claras de seguridad. También trabajaban mujeres y niños. Al mismo tiempo, crecieron los barrios obreros, a menudo con problemas de higiene y vivienda. El transporte cambió mucho. El ferrocarril y los barcos de vapor conectaron regiones y países. Por eso, el comercio aumentó y las materias primas, como el carbón, llegaron con más facilidad a las fábricas. La comunicación mejoró y aparecieron nuevas profesiones. La Revolución Industrial tuvo efectos positivos y negativos. Por un lado, aumentó la producción y el nivel de vida de muchas personas a largo plazo. Por otro lado, creó desigualdades y contaminación. Con el tiempo, los movimientos obreros y las leyes laborales empezaron a proteger más a los trabajadores. Esta etapa transformó la economía, la sociedad y la forma de vivir en Europa.","The Industrial Revolution was a period of great change that began in the 18th century, first in the United Kingdom and then in other European countries. Before that, most people lived in the countryside and worked in agriculture or small craft workshops. With the arrival of new machines, such as the steam engine, production began to take place in factories. This made it possible to manufacture textiles, iron, and other products more quickly and cheaply. Many people moved to cities to work as laborers. The working days were long and the wages low. Working conditions were difficult and there were no clear safety standards. Women and children also worked. At the same time, working-class neighborhoods grew, often with problems of hygiene and housing. Transportation changed significantly. Railways and steamships connected regions and countries. As a result, trade increased and raw materials, such as coal, reached factories more easily. Communication improved and new professions emerged. The Industrial Revolution had both positive and negative effects. On the one hand, it increased production and the standard of living for many people in the long term. On the other hand, it created inequalities and pollution. Over time, labor movements and labor laws began to provide greater protection for workers. This period transformed the economy, society, and way of life in Europe."
Lo kafkiano,The Kafkaesque,drama,C,,
La leyenda de Zelda - Ocarina of Time,The Legend of Zelda - Ocarina of Time,art,C,"En el Bosque Kokiri, un niño sin hada sueña con un jinete oscuro que asedia un castillo en llamas. Cuando el Árbol Deku, protector antiguo del bosque, convoca a Navi, la pequeña guía conduce al muchacho hasta sus raíces moribundas. Allí, tras purgar la corrupción que lo carcome desde dentro, el Árbol le revela su destino con su último aliento. Link recibe la Esmeralda Kokiri y una profecía: el equilibrio de Hyrule peligra y solo él, aunque no sea un Kokiri, podrá impedir que el usurpador cumpla su ambición. Con el bosque a sus espaldas, Link cruza praderas y murallas hasta el Castillo de Hyrule. A escondidas, en un jardín silencioso, conoce a la princesa Zelda, que ha tenido el mismo sueño de ruina. Ambos identifican al causante, Ganondorf, caudillo de los gerudo, que finge lealtad al rey mientras busca la Trifuerza, la reliquia que concede a su portador la esencia de la virtud que encarna. Zelda urde un plan sencillo y peligroso. Link debe reunir las tres Piedras Espirituales que sellan la Puerta del Tiempo. Con una carta de la princesa y la tutela de Impa, Link se lanza a la tarea sin saber que el éxito del plan también puede abrir el camino al enemigo. En la Montaña de la Muerte, los goron padecen hambre porque los dodongos se han adueñado de su mina. Link gana la confianza de Darunia con música, limpia la Caverna Dodongo y recibe el Rubí Goron como muestra de hermandad. En el Dominio Zora, el dios-pez Jabu-Jabu ha enfermado. Link, acompañado a regañadientes por la princesa Ruto, atraviesa el interior del coloso y derrota a la aberración que lo parasita. A cambio, Ruto le entrega el Zafiro Zora, un gesto que en su cultura equivale a una promesa matrimonial, aunque el muchacho no alcanza a calibrar su peso. Con las tres piedras y la ocarina que Zelda arroja al foso mientras huye perseguida por Ganondorf, Link abre el Templo del Tiempo y empuña la Espada Maestra. El filo lo juzga demasiado joven y lo sella en una cámara suspendida durante siete años. Despierta adulto en la Cámara de los Sabios. Rauru le explica lo ocurrido. Al retirar la espada, el sello secular se debilitó, Ganondorf penetró en el Reino Sagrado y, al tocar la Trifuerza, solo obtuvo su fragmento de Poder. Los otros dos, Coraje y Sabiduría, se dispersaron. Hyrule ha caído en una noche lenta de siete años. Para revertirla, Link debe despertar a los Sabios de cada tribu, prisioneros en templos pervertidos. Guiado por un misterioso Sheik, que aparece en los momentos justos y le enseña melodías de transporte, Link regresa a un bosque extraño, con raíces torcidas y espíritus errantes. Saria, su amiga de la infancia, es el Sabio del Bosque, aunque el despertar la separa para siempre de la vida del bosque. En la caldera de la Montaña de la Muerte, Darunia lucha por su gente y entrega su destino al fuego purificador. En el Lago Hylia, la belleza fría oculta trampas. El Templo del Agua exige paciencia y memoria espacial, y el propio Link se enfrenta a su sombra, un reflejo que aprende de cada movimiento, metáfora de una identidad que solo se consolida al ser cuestionada. Más al norte, Kakariko arde en un estallido de sombras. Impa mantiene a raya a los espíritus mientras Link desciende al Pozo y al Templo de las Sombras, donde los ecos del pasado revelan torturas y secretos que el reino prefirió no mirar. En el desierto, entre ruinas gerudo y espejismos, Nabooru se rebela contra Ganondorf. Link atraviesa el Templo del Espíritu, alternando entre su yo niño y su yo adulto, porque algunas puertas solo ceden cuando coexisten la inocencia y la fuerza. Con los seis Sabios despiertos, Sheik revela su identidad. Zelda, que había llevado meses disfrazada, custodiaba la Trifuerza de la Sabiduría. La revelación dura un instante. Ganondorf la atrapa en un cristal y se atrinchera en su torre. Los Sabios levantan un puente de luz y Link asciende planta a planta, rompiendo barreras elementales con los regalos de cada templo. En la cúspide, el rey de los ladrones lo espera entre vitrales y órganos resonantes. La batalla es técnica y obstinada. Zelda, liberada, lanza Flechas de Luz que fisuran la defensa de Ganondorf. Derrotado, derrumba la torre en un último acto de rencor. En las ruinas humeantes, sin música ni adorno, el enemigo resurge convertido en bestia. Ganon, privado de malicia sutil, combate con puro instinto. La Espada Maestra cae lejos, las columnas se quiebran. Zelda contiene a la criatura con un sello breve, suficiente para que Link recupere el filo y remate con precisión ritual. Los Sabios sellan a Ganon en el Vacío, no muerto sino aplazado, y Zelda elige la única reparación posible. Devuelve a Link a su tiempo para que recupere lo que le fue arrebatado, una adolescencia sin guerras ni cicatrices de adulto prematuro. El héroe reaparece en el Templo del Tiempo del pasado, con la ocarina aún tibia y el eco de canciones que ya no deberían conocerlo. Cruza el patio y se planta ante Zelda niña. No lleva trofeos, solo memoria. Al contarle lo sucedido, altera la corriente de los hechos y abre la puerta a futuros divergentes. En Kokiri, el bosque respira, pero Saria ya sabe que su destino está atado al templo. En el castillo, el rey vive, aunque las sombras continúan merodeando en los márgenes. En el desierto, una parte de los gerudo empieza a cuestionar a su caudillo. Nada vuelve exactamente al punto de partida. Así termina y recomienza la historia. Una ocarina capaz de plegar el tiempo, una espada que distingue la madurez genuina del brío infantil y un reino que entiende demasiado tarde que la inocencia nunca fue una muralla. Link guarda el instrumento, no para invocar milagros, sino para recordar que incluso la música, si no se interpreta a su debido tiempo, puede abrir la puerta a una catástrofe. Zelda vuelve a mirar por la ventana del jardín. El héroe no se inclina. Simplemente asiente. Ambos comprenden que han vivido un relato que el mundo no sabrá narrar sin perder matices, y que la paz, cuando llega, no es olvido, sino un silencio conquistado.","In Kokiri Forest, a fairyless boy dreams of a dark rider besieging a burning castle. When the Deku Tree, the forest's ancient protector, summons Navi, the tiny guide leads the boy to its dying roots. There, after purging the corruption that gnaws at him from within, the Tree reveals his destiny with its dying breath. Link receives the Kokiri Emerald and a prophecy: the balance of Hyrule is in danger, and only he, though not a Kokiri, can prevent the usurper from fulfilling his ambition. With the forest at his back, Link crosses meadows and walls to Hyrule Castle. Secretly, in a quiet garden, he meets Princess Zelda, who has had the same dream of ruin. Both identify the causer: Ganondorf, leader of the Gerudo, who feigns loyalty to the king while searching for the Triforce, the relic that grants its bearer the essence of virtue it embodies. Zelda hatches a simple and dangerous plan. Link must gather the three Spirit Stones that seal the Gate of Time. Armed with a letter from the princess and Impa's guidance, Link sets out on the task, unaware that a successful plan could also open the way for the enemy. On Death Mountain, the Gorons are starving because the Dodongos have taken over their mine. Link gains Darunia's trust with music, cleans Dodongo's Cavern, and receives the Goron Ruby as a token of brotherhood. In Zora's Domain, the fish-god Jabu-Jabu has fallen ill. Link, reluctantly accompanied by Princess Ruto, traverses the interior of the colossus and defeats the aberration parasitizing it. In return, Ruto gives him the Zora Sapphire, a gesture that in their culture is equivalent to a marriage promise, although the boy cannot fully gauge its weight. With the three stones and the ocarina that Zelda threw into the pit while fleeing, pursued by Ganondorf, Link opens the Temple of Time and wields the Master Sword. The blade judges him too young and seals him in a suspended chamber for seven years. He awakens as an adult in the Chamber of Sages. Rauru explains what happened. Upon withdrawing the sword, the centuries-old seal weakened, Ganondorf entered the Sacred Realm, and upon touching the Triforce, he obtained only his fragment of Power. The other two, Courage and Wisdom, dispersed. Hyrule has fallen into a slow, seven-year night. To reverse it, Link must awaken the Sages of each tribe, imprisoned in perverted temples. Guided by a mysterious Sheik, who appears at just the right moments and teaches him melodies of transportation, Link returns to a strange forest, with twisted roots and wandering spirits. Saria, his childhood friend, is the Sage of the Forest, although awakening separates her forever from the life of the forest. In the cauldron of Death Mountain, Darunia fights for her people and surrenders their destiny to the purifying fire. At Lake Hylia, the cold beauty hides traps. The Water Temple demands patience and spatial memory, and Link himself confronts his shadow, a reflection that learns from every move, a metaphor for an identity only solidified when questioned. Further north, Kakariko ignites in a blaze of shadows. Impa keeps the spirits at bay as Link descends into the Well and the Shadow Temple, where echoes of the past reveal tortures and secrets the kingdom chose not to look upon. In the desert, among Gerudo ruins and mirages, Nabooru rebels against Ganondorf. Link traverses the Spirit Temple, alternating between his child and adult self, for some doors only yield when innocence and strength coexist. With the six Sages awakened, Sheik reveals her identity. Zelda, who had been in disguise for months, guarded the Triforce of Wisdom. The revelation lasts an instant. Ganondorf traps her in a crystal and barricades himself in his tower. The Sages raise a bridge of light, and Link ascends floor by floor, breaking elemental barriers with the gifts of each temple. At the top, the King of Thieves awaits him among stained-glass windows and resonant organs. The battle is technical and stubborn. Zelda, freed, launches Arrows of Light that crack Ganondorf's defenses. Defeated, he collapses the tower in a final act of spite. In the smoking ruins, without music or embellishment, the enemy reemerges as a beast. Ganon, deprived of subtle malice, fights with pure instinct. The Master Sword falls far away, the columns shatter. Zelda restrains the creature with a brief seal, long enough for Link to regain his edge and finish with ritual precision. The Sages seal Ganon in the Void, not dead but postponed, and Zelda chooses the only possible remedy. Return Link to his own time so he can recover what was stolen from him: an adolescence without wars or the scars of a premature adult. The hero reappears in the Temple of Time of the past, with the ocarina still warm and the echo of songs that should no longer know him. He crosses the courtyard and stands before the child Zelda. He carries no trophies, only memory. By telling him what happened, she alters the course of events and opens the door to divergent futures. In Kokiri, the forest breathes, but Saria already knows that her destiny is tied to the temple. In the castle, the king lives, although shadows continue to lurk on the margins. In the desert, a portion of the Gerudo begin to question their leader. Nothing returns exactly to where it started. Thus ends and begins again the story. An ocarina capable of bending time, a sword that distinguishes genuine maturity from childish vigor, and a kingdom that understands too late that innocence was never a wall. Link puts the instrument away, not to invoke miracles, but to remember that even music, if not played in due time, can open the door to catastrophe. Zelda looks out the garden window again. The hero doesn't bow. He simply nods. They both understand that they have lived a story that the world will not know how to tell without losing nuances, and that peace, when it comes, is not oblivion, but a silence conquered."
La vida de los otros,The Lives of Others,drama,B2,"En 1984, en la República Democrática Alemana, el capitán Gerd Wiesler trabaja para la Stasi como experto en vigilancia. Le encargan vigilar a Georg Dreyman, un dramaturgo famoso y aparentemente leal al régimen, y a su pareja, la actriz Christa-Maria Sieland. La operación no es solo política. El ministro Hempf desea a Christa-Maria y, con esa excusa, fuerza la investigación. Wiesler instala micrófonos en el piso y empieza a escuchar sus vidas día y noche. Al principio, Wiesler es un funcionario frío y meticuloso. Poco a poco, al oír conversaciones íntimas, silencios y música, empieza a cambiar. Dreyman se entera del suicidio de un director de teatro vetado y decide escribir en secreto un artículo para una revista occidental sobre el tabú de los suicidios en la RDA. Un amigo le consigue una pequeña máquina de escribir, que esconde bajo el umbral del suelo. Wiesler descubre el plan, pero en lugar de detenerlo, lo protege. Manipula informes, suaviza transcripciones y, antes de un registro, llega a retirar la máquina de su escondite para que los agentes no la encuentren. Christa-Maria, mientras tanto, vive atrapada entre su talento, su dependencia y el acoso del ministro. La Stasi la presiona y la amenaza con destruir su carrera. Bajo ese chantaje, termina delatando a Dreyman y revela el escondite de la máquina. Cuando comprende lo que ha hecho, intenta rectificar, huye a la calle y muere atropellada. Dreyman queda roto, sin saber que alguien dentro de la propia Stasi lo ha estado cuidando. A Wiesler lo degradan por no haber producido resultados claros. Pasa de investigador estrella a abrir cartas en un sótano, luego a repartir correo. Su vida se reduce a una rutina gris, pero mantiene el secreto. Tras la caída del Muro, Dreyman solicita sus expedientes y descubre la verdad. Lee páginas y páginas firmadas con el código HGW XX/7, donde se ve cómo aquel agente lo salvó. Entiende que no estuvo solo. Años después publica un libro titulado Sonata para un hombre bueno, dedicado a HGW XX/7. Wiesler, ahora cartero, entra en una librería, lo abre y lee la dedicatoria. Cuando la dependienta le pregunta si quiere envolverlo, contesta simplemente que no, que es para él.","In 1984, in the German Democratic Republic, Captain Gerd Wiesler works for the Stasi as a surveillance expert. He is assigned to monitor Georg Dreyman, a famous playwright apparently loyal to the regime, and his partner, actress Christa-Maria Sieland. The operation is not merely political. Minister Hempf desires Christa-Maria and, using this as an excuse, forces the investigation. Wiesler installs microphones in the apartment and begins listening in on their lives day and night. At first, Wiesler is a cold and meticulous civil servant. Little by little, as he overhears intimate conversations, silences, and music, he begins to change. Dreyman learns of the suicide of a banned theater director and decides to secretly write an article for a Western magazine about the taboo against suicide in the GDR. A friend gets him a small typewriter, which he hides under the threshold. Wiesler discovers the plan, but instead of stopping it, he protects it. He manipulates reports, softens transcripts, and, before a search, even removes the machine from its hiding place so the agents wouldn't find it. Christa-Maria, meanwhile, lives trapped between her talent, her dependency, and the minister's harassment. The Stasi pressures her and threatens to destroy her career. Under this blackmail, she ends up betraying Dreyman and revealing the machine's hiding place. When she realizes what she's done, she tries to rectify it, flees into the street, and is run over. Dreyman is devastated, unaware that someone within the Stasi itself has been watching over him. Wiesler is demoted for failing to produce clear results. He goes from star investigator to opening letters in a basement, then to delivering mail. His life is reduced to a drab routine, but he maintains the secret. After the fall of the Wall, Dreyman requests his files and discovers the truth. He reads pages and pages signed with the code HGW XX/7, where we see how that agent saved him. He understands that he was not alone. Years later, he published a book titled Sonata for a Good Man, dedicated to HGW XX/7. Wiesler, now a postman, entered a bookstore, opened it, and read the dedication. When the clerk asked him if he would like it wrapped, he simply replied no, that it was for him."
La cartera perdida,The Lost Wallet,dialogue,A2,"Laura salió de la cafetería con una sonrisa. Había tomado un café con su amiga Marta y ahora caminaba hacia la parada de autobús. De repente, Laura se paró y dijo: «¡Ay, no! Mi cartera… no la encuentro.» Marta la miró con sorpresa. «¿Tu cartera? ¿Estás segura de que no la tienes en el bolso?» Laura abrió el bolso y buscó nerviosamente. «No está aquí. Tenía dinero, mi tarjeta y el carnet de estudiante.» «Piensa bien», respondió Marta con calma. «¿La usaste en la cafetería?» «Sí, pagué mi café con ella», contestó Laura. Sus ojos se llenaron de preocupación. «Quizá la dejé en la mesa.» Las dos amigas entraron rápidamente en la cafetería. Laura se acercó al camarero y le preguntó: «Perdón, ¿ha visto una cartera negra en la mesa de la ventana?» El camarero sonrió y levantó una cartera. «¿Es esta?» Laura la tomó con alivio. «¡Sí, es mía! Muchísimas gracias.» Marta rió y dijo: «¡Qué suerte tienes! La próxima vez, guarda la cartera en un lugar seguro.» Laura suspiró y sonrió también. «Tienes razón. Hoy aprendí la lección.»","Laura left the café with a smile. She had had coffee with her friend Marta and was now walking to the bus stop. Suddenly, Laura stopped and said, “Oh no! My wallet... I can't find it.” Marta looked at her in surprise. “Your wallet? Are you sure it's not in your bag?” Laura opened her bag and searched nervously. “It's not here. I had money, my card, and my student ID in it.” “Think carefully,” Marta replied calmly. “Did you use it at the café?” “Yes, I paid for my coffee with it,” Laura replied. Her eyes filled with worry. “Maybe I left it on the table.” The two friends quickly went back into the café. Laura approached the waiter and asked, “Excuse me, have you seen a black wallet on the window table?” The waiter smiled and held up a wallet. “Is this it?” Laura took it with relief. “Yes, it's mine! Thank you so much.” Marta laughed and said, “You're so lucky! Next time, keep your wallet in a safe place.” Laura sighed and smiled too. “You're right. I learned my lesson today.”"
Dieta mediterránea,The Mediterranean Diet,health,A2,"La dieta mediterránea es un estilo de vida, no solo una lista de comidas. Se basa en frutas y verduras frescas, legumbres, cereales integrales, aceite de oliva y pescado, sobre todo pescado azul. La carne roja se come pocas veces al mes y en porciones pequeñas. Los postres suelen ser fruta. Se bebe agua durante el día y, en adultos, a veces vino con moderación en las comidas. También es importante cocinar en casa y compartir la mesa con la familia o los amigos. Un día típico puede ser así: para desayunar, pan integral con tomate y aceite de oliva, y café con leche o té. A media mañana, un yogur natural o una pieza de fruta. Para comer, una ensalada grande, lentejas o arroz con verduras, y pescado a la plancha. De merienda, un puñado de frutos secos. Para cenar, crema de verduras y una tortilla francesa con ensalada. Este modelo ayuda al corazón y al peso, porque los alimentos son naturales y tienen fibra. Además, caminar cada día y dormir bien forma parte de la misma idea de salud.","The Mediterranean diet is a lifestyle, not just a list of foods. It is based on fresh fruits and vegetables, legumes, whole grains, olive oil, and fish, especially oily fish. Red meat is eaten only a few times a month and in small portions. Desserts are usually fruit. Water is drunk throughout the day and, for adults, sometimes wine in moderation with meals. It is also important to cook at home and share meals with family or friends. A typical day might look like this: for breakfast, whole grain bread with tomato and olive oil, and coffee with milk or tea. Mid-morning, a plain yogurt or a piece of fruit. For lunch, a large salad, lentils or rice with vegetables, and grilled fish. For an afternoon snack, a handful of nuts. For dinner, cream of vegetable soup and a French omelet with salad. This model is good for the heart and weight, because the foods are natural and contain fiber. In addition, walking every day and sleeping well are part of the same idea of health."
La metamorfosis,The Metamorphosis,drama,C,,
El cine,The Movie Theater,dialogue,A1,"Lucía y Marta caminan por la calle. El sol ya está bajo y las luces del cine brillan. “¿Quieres ir al cine esta noche?” pregunta Lucía con una sonrisa. “Sí, quiero mucho. ¿Qué película vemos?” responde Marta. Lucía mira el cartel. “Hay una comedia y una película de acción.” “Prefiero la comedia,” dice Marta. “Me gusta reír.” “Perfecto,” responde Lucía. “¿A qué hora empieza?” “A las ocho,” contesta Marta. “Tenemos tiempo.” Las dos entran en el cine, contentas, y compran sus entradas.","Lucía and Marta are walking down the street. The sun is already low and the movie theater lights are shining brightly. “Do you want to go to the movies tonight?” Lucía asks with a smile. “Yes, I'd love to. What movie should we see?” Marta replies. Lucía looks at the poster. “There's a comedy and an action movie.” “I prefer the comedy,” says Marta. “I like to laugh.” “Perfect,” replies Lucía. “What time does it start?” “At eight,” answers Marta. “We have time.” The two enter the cinema, happy, and buy their tickets."
