titleSpanish,titleEnglish,genre,CEFR,spanish,english
Sistemas políticos del mundo,Political Systems of the World,politics,A1,"En el mundo hay varios sistemas políticos. Algunos países son democracias. En una democracia, las personas votan y eligen a sus representantes. Hay elecciones cada pocos años. Las leyes protegen derechos básicos. Otros países son monarquías. En una monarquía parlamentaria hay rey o reina y también un parlamento elegido. España y Noruega son ejemplos. El rey representa al país y el gobierno toma decisiones. También existen repúblicas. En una república no hay rey. Hay un presidente elegido. Francia e Italia son repúblicas. En algunos países hay un solo partido político. El mismo partido controla el gobierno y no hay otros partidos. Cada sistema busca orden y seguridad. Muchas personas quieren participar, vivir con justicia y paz, y por eso hablan, votan y respetan las leyes.","In the world there are several political systems. Some countries are democracies. In a democracy, people vote and choose their representatives. There are elections every few years. The laws protect basic rights. Other countries are monarchies. In a parliamentary monarchy there is a king or queen and also an elected parliament. Spain and Norway are examples. The king represents the country and the government makes decisions. Republics also exist. In a republic there is no king. There is an elected president. France and Italy are republics. In some countries there is only one political party. The same party controls the government and there are no other parties. Each system seeks order and security. Many people want to participate, live with justice and peace, and so they speak, vote, and respect the laws."
Prepararse para un examen,Preparing for an Exam,monologue,A2,"Mañana tengo un examen y estoy un poco nervioso. Para preparar el examen, hago un plan. Primero, leo mis apuntes de clase y subrayo las ideas más importantes. Después, repito en voz alta para recordar mejor. También escribo algunas frases en un papel, porque así puedo practicar la memoria. Cuando no entiendo algo, miro el libro o busco la explicación en Internet. A veces estudio con un compañero, porque es más divertido y podemos hacernos preguntas. El día antes del examen intento relajarme un poco. No quiero estudiar demasiado tarde, porque necesito dormir bien. También preparo mi mochila con el bolígrafo, el cuaderno y una botella de agua. Creo que la mejor forma de preparar un examen es estudiar cada día un poco, no solo al final. Así me siento más tranquilo y seguro cuando llega el momento.","I have an exam tomorrow and I'm a little nervous. To prepare for the exam, I make a plan. First, I read my class notes and underline the most important ideas. Then, I repeat them aloud to remember them better. I also write some sentences on a piece of paper, because that way I can practice my memory. When I don't understand something, I look it up in the book or search for the explanation on the Internet. Sometimes I study with a classmate because it's more fun and we can ask each other questions. The day before the exam, I try to relax a little. I don't want to study too late because I need to sleep well. I also pack my backpack with a pen, notebook, and a bottle of water. I think the best way to prepare for an exam is to study a little every day, not just at the end. That way, I feel calmer and more confident when the time comes."
Procrastinación,Procrastination,psychology,B2,"La procrastinación es un hábito muy común que afecta a estudiantes, trabajadores e incluso a personas que parecen muy organizadas. Consiste en retrasar tareas importantes y sustituirlas por actividades menos urgentes pero más agradables o fáciles de realizar. Por ejemplo, en lugar de preparar un examen o terminar un informe, alguien puede pasar horas mirando series, navegando por internet o limpiando la casa. Aunque en un primer momento posponer una tarea puede producir alivio, con el tiempo genera más estrés y sensación de culpa. Muchas veces la procrastinación está relacionada con el miedo al fracaso, la falta de motivación o la dificultad para gestionar el tiempo. Sin embargo, es posible combatirla con estrategias sencillas. Una de ellas es dividir los proyectos grandes en pasos pequeños y alcanzables, lo que da una sensación de progreso. Otra es establecer horarios específicos y evitar distracciones como el teléfono móvil. Superar la procrastinación no significa eliminarla por completo, sino aprender a reconocer cuándo ocurre y tomar decisiones conscientes para avanzar. Con práctica y disciplina, se puede transformar la tendencia a aplazar las cosas en una oportunidad para desarrollar más autocontrol y confianza personal.","Procrastination is a very common habit that affects students, workers, and even people who seem very organized. It consists of delaying important tasks and replacing them with less urgent but more enjoyable or easier activities. For example, instead of preparing for an exam or finishing a report, someone may spend hours watching TV series, surfing the internet, or cleaning the house. Although postponing a task may bring relief at first, over time it generates more stress and guilt. Procrastination is often related to fear of failure, lack of motivation, or difficulty managing time. However, it is possible to combat it with simple strategies. One is to break large projects down into small, achievable steps, which gives a sense of progress. Another is to set specific schedules and avoid distractions such as cell phones. Overcoming procrastination does not mean eliminating it completely, but learning to recognize when it occurs and making conscious decisions to move forward. With practice and discipline, you can transform the tendency to put things off into an opportunity to develop more self-control and personal confidence."
Mapas de transporte público,Public Transit Maps,travel,B1,"Cuando viajo a una ciudad nueva, siempre busco un mapa del transporte público. Estos mapas me ayudan a moverme sin perder tiempo y a conocer mejor el lugar. Normalmente muestran las líneas de metro, tranvía y autobús con diferentes colores. Al principio pueden parecer un poco confusos, porque hay muchas paradas y conexiones, pero después de usarlos varias veces se vuelven fáciles de entender. Creo que los mapas digitales en el móvil son muy útiles, ya que indican el trayecto más rápido y hasta el tiempo que falta para que llegue el próximo tren o autobús. Sin embargo, los mapas en papel también son importantes, sobre todo cuando no hay conexión a internet. En mi opinión, saber leer un mapa de transporte público da mucha libertad. Permite viajar solo, descubrir barrios nuevos y ahorrar dinero, porque no es necesario tomar taxis. Por eso, siempre recomiendo a los turistas que aprendan a usar el mapa antes de empezar a explorar la ciudad.","When I travel to a new city, I always look for a public transportation map. These maps help me get around without wasting time and get to know the place better. They usually show subway, tram, and bus lines in different colors. At first, they can seem a little confusing because there are so many stops and connections, but after using them a few times, they become easy to understand. I think digital maps on your phone are very useful, as they show the fastest route and even how long it will take for the next train or bus to arrive. However, paper maps are also important, especially when there is no internet connection. In my opinion, knowing how to read a public transportation map gives you a lot of freedom. It allows you to travel alone, discover new neighborhoods, and save money because you don't have to take taxis. That's why I always recommend that tourists learn how to use the map before they start exploring the city."
La vida queer en España,Queer Life in Spain,culture,B2,"La vida queer en España ha cambiado mucho en las últimas décadas. Hoy en día, el país es visto como uno de los más avanzados de Europa en cuanto a derechos LGTBIQ+. Desde 2005, el matrimonio entre personas del mismo sexo es legal, y esto convirtió a España en uno de los primeros países del mundo en reconocerlo. Esta ley fue un gran paso, no solo en lo legal, sino también en la manera en la que la sociedad percibe la diversidad sexual. En las grandes ciudades, como Madrid y Barcelona, existen barrios muy conocidos por su ambiente inclusivo. Chueca, en Madrid, es un ejemplo famoso: allí se pueden encontrar bares, librerías y asociaciones que apoyan a la comunidad queer. Además, las celebraciones del Orgullo atraen a millones de personas cada año, tanto de dentro como de fuera del país, y simbolizan la visibilidad y la lucha por la igualdad. Sin embargo, aunque España sea un referente en Europa, todavía hay retos importantes. En zonas rurales, muchas personas queer siguen enfrentándose al silencio, la discriminación o la falta de referentes. También, en los últimos años, se han registrado algunos casos de violencia homófoba que recuerdan que la igualdad legal no siempre significa igualdad real en la vida cotidiana. A pesar de estos desafíos, la sociedad española muestra una actitud cada vez más abierta. Las generaciones más jóvenes suelen tener una visión inclusiva y natural sobre la diversidad sexual y de género. Esto permite que la vida queer en España sea, en general, más visible, más segura y con más oportunidades que en otros lugares del mundo.","Queer life in Spain has changed significantly in recent decades. Today, the country is seen as one of the most progressive in Europe in terms of LGTBIQ+ rights. Same-sex marriage has been legal since 2005, making Spain one of the first countries in the world to recognize it. This law was a big step forward, not only legally, but also in terms of how society perceives sexual diversity. In large cities such as Madrid and Barcelona, there are neighborhoods well known for their inclusive atmosphere. Chueca, in Madrid, is a famous example: there you can find bars, bookstores, and associations that support the queer community. In addition, Pride celebrations attract millions of people every year, both from within and outside the country, and symbolize visibility and the fight for equality. However, although Spain is a benchmark in Europe, there are still significant challenges. In rural areas, many queer people continue to face silence, discrimination, or a lack of role models. In recent years, there have also been some cases of homophobic violence, reminding us that legal equality does not always mean real equality in everyday life. Despite these challenges, Spanish society is becoming increasingly open-minded. Younger generations tend to have an inclusive and natural view of sexual and gender diversity. This allows queer life in Spain to be, in general, more visible, safer, and with more opportunities than in other parts of the world."
Reciclaje,Recycling,technology,A2,"En mi ciudad hay muchos contenedores de colores para reciclar. El contenedor azul es para el papel y el cartón, el verde es para el vidrio y el amarillo es para los envases de plástico y de metal. También hay un contenedor marrón para la basura orgánica, como restos de comida. Reciclar es muy importante porque ayuda a cuidar el medio ambiente. Cuando reciclamos, damos una nueva vida a los materiales y producimos menos basura. Además, así usamos menos recursos naturales. En mi familia intentamos reciclar todos los días. Antes de tirar algo a la basura, pensamos: ¿se puede reciclar? Si la respuesta es sí, lo ponemos en el contenedor correcto. Es fácil, solo necesitamos un poco de organización. Creo que si todos reciclamos, nuestras ciudades estarán más limpias y podremos vivir en un mundo más sano y más bonito.","In my city, there are many colored recycling bins. The blue bin is for paper and cardboard, the green one is for glass, and the yellow one is for plastic and metal containers. There is also a brown bin for organic waste, such as food scraps. Recycling is very important because it helps protect the environment. When we recycle, we give materials a new life and produce less waste. In addition, we use fewer natural resources. In my family, we try to recycle every day. Before throwing something away, we think: can it be recycled? If the answer is yes, we put it in the correct bin. It's easy, we just need a little organization. I believe that if we all recycle, our cities will be cleaner and we will be able to live in a healthier and more beautiful world."
Diferencias regionales en español,Regional Differences in Spanish,language,A2,"El español es una lengua muy grande y muy variada. Se habla en muchos países, pero también dentro de España hay diferencias. Por ejemplo, en el sur, en Andalucía, las personas hablan más rápido y a veces no pronuncian todas las letras, como la s al final de las palabras. En el norte, en lugares como Castilla y León, el acento es más claro y las palabras se entienden fácilmente. En Cataluña o Galicia, muchas personas hablan dos lenguas: español y catalán, o español y gallego. Esto hace que el acento del español sea un poco diferente. En las Islas Canarias, el español suena más parecido al de América Latina, porque allí hubo mucha conexión en el pasado. Todas estas diferencias hacen que el español sea una lengua muy rica. A veces es un poco difícil entender algunos acentos, pero poco a poco se aprende y es algo muy interesante.","Spanish is a very large and varied language. It is spoken in many countries, but there are also differences within Spain. For example, in the south, in Andalusia, people speak more quickly and sometimes do not pronounce all the letters, such as the s at the end of words. In the north, in places such as Castile and León, the accent is clearer and the words are easily understood. In Catalonia or Galicia, many people speak two languages: Spanish and Catalan, or Spanish and Galician. This makes the accent of Spanish a little different. In the Canary Islands, Spanish sounds more like Latin American Spanish because there was a strong connection between the two in the past. All these differences make Spanish a very rich language. Sometimes it is a little difficult to understand some accents, but little by little you learn, and it is very interesting."
Arrepentimiento,Regret,psychology,B1,"El arrepentimiento es una emoción que casi todas las personas sienten en algún momento de su vida. Aparece cuando miramos atrás y pensamos que podríamos haber hecho algo de otra manera. A veces sentimos arrepentimiento por decisiones pequeñas, como no haber estudiado lo suficiente para un examen o no haber aceptado una invitación de un amigo. En otras ocasiones, el arrepentimiento puede estar relacionado con temas más grandes, como elegir un trabajo, una pareja o un lugar para vivir. El problema es que el arrepentimiento suele traer consigo tristeza o frustración, porque creemos que hemos perdido una oportunidad. Sin embargo, también puede tener un aspecto positivo: nos ayuda a reflexionar sobre nuestras acciones y a aprender de los errores. Cuando sentimos arrepentimiento, tenemos la posibilidad de crecer como personas, ya que entendemos mejor lo que queremos y lo que valoramos. Lo importante es no quedarnos atrapados en el pasado. El arrepentimiento debe ser una señal para mejorar en el futuro, no una carga que nos impida avanzar.","Regret is an emotion that almost everyone feels at some point in their lives. It arises when we look back and think that we could have done something differently. Sometimes we feel regret about small decisions, such as not studying enough for an exam or not accepting an invitation from a friend. Other times, regret can be related to bigger issues, such as choosing a job, a partner, or a place to live. The problem is that regret often brings sadness or frustration because we believe we have missed an opportunity. However, it can also have a positive side: it helps us reflect on our actions and learn from our mistakes. When we feel regret, we have the chance to grow as people, as we better understand what we want and what we value. The important thing is not to get stuck in the past. Regret should be a sign to improve in the future, not a burden that prevents us from moving forward."
Roma,Rome,travel,A2,"Roma es una ciudad muy famosa en Italia. Muchas personas la visitan cada año porque tiene una historia muy larga e interesante. En Roma hay monumentos antiguos, como el Coliseo y el Foro Romano, donde los romanos vivían y trabajaban hace más de dos mil años. También es la ciudad del Vaticano, donde vive el Papa. Allí está la Basílica de San Pedro, una iglesia muy grande y bonita. Roma no es solo historia; también es una ciudad moderna. Hay calles con tiendas, restaurantes y cafeterías donde se puede probar la pizza, la pasta o un buen café. Pasear por Roma es una experiencia especial, porque en cada esquina se pueden ver fuentes, plazas y edificios llenos de arte. Por eso, muchas personas dicen que Roma es como un museo al aire libre.","Rome is a very famous city in Italy. Many people visit it every year because it has a very long and interesting history. In Rome, there are ancient monuments, such as the Colosseum and the Roman Forum, where the Romans lived and worked more than two thousand years ago. It is also the city of the Vatican, where the Pope lives. There you will find St. Peter's Basilica, a very large and beautiful church. Rome is not only history; it is also a modern city. There are streets with shops, restaurants, and cafes where you can try pizza, pasta, or a good coffee. Walking around Rome is a special experience because at every corner you can see fountains, squares, and buildings full of art. That is why many people say that Rome is like an open-air museum."
Sapiens,Sapiens,history,B2,"El libro Sapiens: De animales a dioses, escrito por Yuval Noah Harari, es una obra que explora la historia de la humanidad desde los primeros homínidos hasta el mundo contemporáneo. Lo interesante de este libro es que no solo habla de hechos históricos, sino que también analiza cómo las ideas, las creencias y las estructuras sociales han influido en el desarrollo de nuestra especie. Harari explica, por ejemplo, que lo que diferencia a los seres humanos de otros animales no es únicamente la inteligencia, sino la capacidad de crear y compartir ficciones colectivas. Religiones, naciones y sistemas económicos son, en realidad, construcciones que funcionan porque millones de personas creen en ellas. Además, el autor describe las principales “revoluciones” que marcaron el rumbo de la humanidad: la cognitiva, la agrícola y la científica. Cada una de ellas transformó la manera en la que los seres humanos se organizan y se relacionan entre sí. Sapiens invita al lector a reflexionar sobre el pasado para entender mejor el presente y, sobre todo, para cuestionarse hacia dónde vamos como especie. Es un libro accesible y estimulante, que despierta curiosidad y genera debates interesantes sobre la naturaleza y el futuro de la humanidad.","The book Sapiens: From Animals to Gods, written by Yuval Noah Harari, explores the history of humanity from the earliest hominids to the contemporary world. What is interesting about this book is that it not only discusses historical events, but also analyzes how ideas, beliefs, and social structures have influenced the development of our species. Harari explains, for example, that what differentiates humans from other animals is not only intelligence, but the ability to create and share collective fictions. Religions, nations, and economic systems are, in reality, constructs that function because millions of people believe in them. In addition, the author describes the major “revolutions” that shaped the course of humanity: the cognitive, agricultural, and scientific revolutions. Each of these transformed the way humans organize and relate to each other. Sapiens invites readers to reflect on the past in order to better understand the present and, above all, to question where we are headed as a species. It is an accessible and stimulating book that arouses curiosity and generates interesting debates about the nature and future of humanity."
Diseño escandinavo,Scandinavian Design,culture,B2,,
Pasadizos secretos,Secret Passageways,fantasy,B1,"En muchos castillos antiguos existen pasadizos secretos que fueron construidos para proteger a los reyes y a los caballeros en tiempos de guerra. Estos túneles conectaban diferentes partes del edificio y permitían escapar sin ser vistos por los enemigos. Algunos pasadizos también servían para transportar comida o mensajes en secreto. En las casas nobles, a veces llevaban a habitaciones escondidas donde se guardaban tesoros o libros prohibidos. Hoy en día, muchos viajeros sienten curiosidad por descubrir estos lugares misteriosos. Cuando visitan un castillo o un monasterio, se imaginan cómo era caminar en silencio por esos pasillos oscuros, con solo una antorcha para iluminar el camino. Aunque ya no se usan para escapar, los pasadizos secretos siguen despertando nuestra imaginación y nos recuerdan que la historia todavía guarda muchos misterios por descubrir.","Many ancient castles have secret passageways that were built to protect kings and knights in times of war. These tunnels connected different parts of the building and allowed people to escape without being seen by enemies. Some passageways were also used to secretly transport food or messages. In noble houses, they sometimes led to hidden rooms where treasures or forbidden books were kept. Today, many travelers are curious to discover these mysterious places. When they visit a castle or monastery, they imagine what it was like to walk silently through those dark corridors, with only a torch to light the way. Although they are no longer used for escape, secret passages continue to spark our imagination and remind us that history still holds many mysteries to be discovered."
Coches autónomos,Self-Driving Cars,technology,A2,"Los coches autónomos son vehículos que pueden conducir solos. Tienen cámaras, radares y un ordenador. Con esta tecnología, el coche ve la carretera, los semáforos y a las personas. El sistema decide cuándo frenar, acelerar y girar. Para muchas personas, un coche autónomo es cómodo. Puedes leer, trabajar o descansar durante el viaje. También puede ayudar a gente mayor o con discapacidad. Además, los coches autónomos pueden reducir accidentes, porque no se cansan ni beben alcohol. Sin embargo, todavía hay problemas. A veces la tecnología falla con la lluvia o la nieve. Las calles son diferentes en cada ciudad. También hay preguntas sobre la culpa en un accidente. ¿Quién paga si pasa algo, la persona o la empresa? Hoy estos coches son caros y no están en todas partes. Pero cada año mejoran. En el futuro, mucha gente va a usar coches autónomos, sobre todo en ciudades grandes. Aun así, siempre necesitaremos normas claras y buena educación vial.","Autonomous cars are vehicles that can drive themselves. They have cameras, radars, and a computer. With this technology, the car sees the road, traffic lights, and people. The system decides when to brake, accelerate, and turn. For many people, an autonomous car is convenient. You can read, work, or rest during the trip. It can also help older people or people with disabilities. In addition, autonomous cars can reduce accidents because they don't get tired or drink alcohol. However, there are still problems. Sometimes the technology fails in rain or snow. Streets are different in every city. There are also questions about who is at fault in an accident. Who pays if something happens, the person or the company? Today, these cars are expensive and not available everywhere. But they are improving every year. In the future, many people will use autonomous cars, especially in large cities. Even so, we will always need clear rules and good driver education."
Seúl,Seoul,travel,A2,"Seúl es la capital de Corea del Sur. Es una ciudad muy grande y moderna. Tiene más de diez millones de habitantes. En Seúl hay muchos rascacielos, pero también hay palacios antiguos y templos tradicionales. El río Han cruza la ciudad, y muchas personas pasean por sus orillas o montan en bicicleta. En el centro de Seúl hay mercados donde se puede comprar comida típica y ropa. La comida coreana es muy famosa; por ejemplo, el kimchi es un plato muy popular y un poco picante. Seúl es también una ciudad tecnológica. Muchas empresas importantes trabajan allí y hay mucho movimiento durante el día. Sin embargo, en los parques y jardines la gente puede descansar y disfrutar de la naturaleza.","Seoul is the capital of South Korea. It is a very large and modern city. It has more than ten million inhabitants. In Seoul there are many skyscrapers, but there are also ancient palaces and traditional temples. The Han River crosses the city, and many people walk along its banks or ride bicycles. In the center of Seoul, there are markets where you can buy traditional food and clothing. Korean food is very famous; for example, kimchi is a very popular dish and a little spicy. Seoul is also a technological city. Many important companies work there, and there is a lot of activity during the day. However, in the parks and gardens, people can relax and enjoy nature."
